product_id,asin,review_id,product_title,star_rating,review_body,review_date,summary,verified_purchase,review_date_iso
p4,B00BD76NZK,A1P86GIH3NJJVH,,5.0,"This stuff really works.  I have an eight year old male cat who has been eating this for most of his adult life.  Not only does he prefer it over other foods (I've offered several, side by side...) but he's never been overweight.  I don't know if that's because of the food or not, but... see below.

The other great thing is that this stuff really does decrease hairballs.  I know, because whenever I run out and have to use a different kind of food for a week or two, my cat's hairball production goes up considerably.

Highly recommended.","12 28, 2016",The other great thing is that this stuff really does decrease hairballs,True,2016-12-28
p4,B00BD76NZK,ANZSDB6HWWUBB,,5.0,This is the only food I have found that keeps my cats from lacking up ducky hairballs all over the rug. Tried IAMS gentle in blue bag and it does not work near as good as the orange bag.,"12 24, 2016",No More Puke.,True,2016-12-24
p4,B00BD76NZK,A3KDWIM9GDBJAH,,5.0,my cats like it and was a great price,"12 21, 2016",Five Stars,True,2016-12-21
p4,B00BD76NZK,A1C2LPK2IEK66S,,5.0,both of my cats love this food.  I have one cat that has an extremely sensitive stomach.  She is so much better since we switched to this food.,"12 21, 2016",Really helped my cats sensitive stomach,True,2016-12-21
p4,B00BD76NZK,A2TAOAM7XWO7YT,,5.0,"Have 4 cats, 1 of them with super sensitive stomach. Mainly bought this for her. She does much better on this than any other I've tried. My other cats prefer the taste of this over theirs, so now all 4 eat this and love it.","12 20, 2016",Good Stuff,True,2016-12-20
p4,B00BD76NZK,A2Y0Q0ITJLCN4P,,5.0,My cats seem to really like this.,"12 17, 2016",Good,True,2016-12-17
p4,B00BD76NZK,AAKVQH4F4PIBJ,,4.0,My six-year old most indoor cat likes this and has been eating it for the last four years or ever since I got her.  I'm hoping that it will keep her healthy and active.,"12 15, 2016",My six-year old most indoor cat likes this and has ...,True,2016-12-15
p4,B00BD76NZK,A32386SJ2OHJ7H,,5.0,"Worked so well, no more cat vomit to clean up.....","12 13, 2016",Five Stars,True,2016-12-13
p4,B00BD76NZK,A2YU8ECS91Z6KH,,2.0,made my cat sick so have stopped using iams. very disappointed!,"12 10, 2016",very disappointed!,True,2016-12-10
p4,B00BD76NZK,A3KYYNUULT98W0,,5.0,"Well, my cat likes it.  He has not complained to me!","12 8, 2016",Cat says meow!,True,2016-12-08
p4,B00BD76NZK,A2GJU01JM5KTJ1,,4.0,Great for an older cat. Really helped cut down on the vomiting of undigested food.,"12 6, 2016",Very Good Product,True,2016-12-06
p4,B00BD76NZK,A2HUWPEXVCNX4J,,5.0,My cats love it and that's all that counts.  One was having a problem with tummy issues and this sure solved it.  I ordered two bags.  They were well packaged and came in record time.  Price was much better than what I was paying at Publix.,"11 25, 2016",Your cats will love it!,True,2016-11-25
p4,B00BD76NZK,A1WEMR7LXY2WJZ,,5.0,I have one cat the seem the throw up a little more than normal and I bought her this food and she has been throwing up near as much.  She still get fur balls and that can't be helped especially since she like to groom our other two cats.,"11 16, 2016",She still get fur balls and that can't be helped especially since she like to groom our other two cats,True,2016-11-16
p4,B00BD76NZK,A3FERIGVIE25CC,,5.0,Only brand of kitty food I buy,"11 7, 2016",Five Stars,True,2016-11-07
p4,B00BD76NZK,A1QBOC76MIOJYP,,5.0,"I have 2 long haired cats. One is a senior and one is about a year old. This food really makes a difference with the senior in particular because she has always had a terrible issue with hairballs. As she gets older, it seems like she throws up food randomly more often, too. She does well with this food though and I can tell a difference even when I switch between different Iams varieties. I like to stick with this one, the Original in the orange bag, and the pink bag for mature cats once in a while. The hairball variety and the Original orange bag seem to be the best for her. The younger cat eats pretty much anything with no issues and despite her constantly grooming her long hair she hasn't had any hairball issues yet at all that Ive noticed. They like this food and do well on it, so I see no reason to switch.","11 4, 2016",Cats like it,True,2016-11-04
p4,B00BD76NZK,A3A4E1IHOC4HJB,,5.0,Great dry food for cats.  Mine love it.,"10 25, 2016",Five Stars,True,2016-10-25
p4,B00BD76NZK,AM58V0ODRJL3Q,,5.0,my cat would not eat anything just nibbled but he likes this big time. He also has not thrown up like with the other foods! I hope it lasts!,"10 25, 2016",Well fed cats,True,2016-10-25
p4,B00BD76NZK,A1GDPC5AQC895F,,5.0,"best food out there for cats with hairball problems.  I have tried others, and they don't seem to work as well.","10 25, 2016",best food out there for cats with hairball problems,True,2016-10-25
p4,B00BD76NZK,A342TJZMYDKBBT,,5.0,My kitties like this.,"10 20, 2016",A good buy!!!,True,2016-10-20
p4,B00BD76NZK,A1LUAKKT4ST6H7,,4.0,Boots eats it but he still has hairball incidents,"10 17, 2016",crunchy,True,2016-10-17
p4,B00BD76NZK,A3OSHFPVSLYNH6,,1.0,Cats won't touch this food got it for good reviews have 4 cats not 1 will eat it.,"10 14, 2016",Cats won't touch the stuff,True,2016-10-14
p4,B00BD76NZK,A2IS0JMC9CKFHC,,5.0,my cats love this food,"10 13, 2016",Five Stars,True,2016-10-13
p4,B00BD76NZK,A2QGZ59996C2Z9,,5.0,"This food has been helpful in returning my chunky cat to a proper, healthy weight.  And, he likes it!","10 8, 2016",Five Stars,True,2016-10-08
p4,B00BD76NZK,A3EQFMC1FOICU7,,5.0,Great cat food.  My cats love this food. It is Iams and cats love the taste.  Also when I first adopted my Leopold from a shelter he kept farting all the time.  It is not a healthy animal that does that; it is caused by upset stomach from the food he was fed.  I started him on Iams right away and in 1 week no more farts at all.  He is extremely healthy and I did try other very well known high quality cat food but Iams is it for me.  Plus I NEVER FEED MY CATS PEOPLE FOOD.  No snacks either.  Their weight is perfect and I do leave food in their bowls all day.,"10 3, 2016",The Only Cat Food,True,2016-10-03
p4,B00BD76NZK,A10KV6IO84TRW3,,5.0,The cats seems to like this dry food. Hopefully its helping with hairballs like it advertises. Only the cats know if they feel any better.,"10 3, 2016",Hairballs...,False,2016-10-03
p4,B00BD76NZK,A3B0D2RQZKS4YP,,4.0,"The cat food itself: I have been supplementing my cat's diet with IAMS Proactive Health Indoor cat food for almost 15 years. My cat is a fussy eater but will eat this cat food. (Though she prefers her canned cat food.) I like that helps with her weight and more importantly to me with reducing hairballs.

Mars Private US: Provided the correct type of IAMS cat food in a very prompt manner and it arrived in perfect condition.","10 1, 2016",Cat and Owner approved,True,2016-10-01
p4,B00BD76NZK,A17RJ6HZH4LEIZ,,5.0,"I have been feeding my 2 older cats, 3 & 6 yoa, this brand from the get-go and they Love it!  Now if I could get the kittens to stay out of it, LOL!","09 21, 2016",Great Food,True,2016-09-21
p4,B00BD76NZK,A28ETU4J2PG09N,,5.0,Our cats love this Purina food.  Size makes it a must to buy online.  Price is reasonable and home delivery is a definite plus.  We have 3 Siamese little girls and they love this food.,"09 20, 2016",OUR GIRLS LOVE IT,True,2016-09-20
p4,B00BD76NZK,A1YJDGVU3FEAU9,,5.0,I have purchased lots of food for my cat. She has soooo many allergies and she gets sick from certain foods. This has helped her maintain digestion. She was getting sick 4 times a day from different cat foods that claimed to help. She loves the taste and her hair is actually starting to grow back on her back. Will purchase again!,"09 19, 2016",Great for Cats with Allergies & Tummy issues,True,2016-09-19
p4,B00BD76NZK,A2GITJ32Y58H3B,,3.0,"More affordable than the pro plan or back to basics. I know it's not the best, but it's better than some of others. My cats turds are huge and they don't seem satiated between feedings. May go back to back to basics or Rachel ray.","09 19, 2016",Meh.,True,2016-09-19
p4,B00BD76NZK,A3DFJILDUT2S6B,,5.0,"I don't know if my kitties like this quite as well as the naturals, however mama does. It seems to give them the oils they need to help control hairballs.","09 18, 2016",I don't know if my kitties like this quite as well as the naturals,True,2016-09-18
p4,B00BD76NZK,A3H3DETVHI12W9,,3.0,"Easy to order and saved me a trip to store.  My cats like this food, but don't love it","09 13, 2016",Three Stars,True,2016-09-13
p4,B00BD76NZK,A2RVA88VJF30W3,,5.0,"My cat likes it. I feel it is a good food. He grew up on Science Diet kitten. Hated the Science Diet adult. He loves this. As with other premium pet foods, don't have to feed as much as a complete cat food. And, he likes this one.","09 4, 2016",Good premium cat food. Worth the money.,True,2016-09-04
p4,B00BD76NZK,A3S80BMW3MM28P,,5.0,This bag lasts my cat over 3 months - much more economical than buying the small bags from the grocery store.  I store in an air-tight pet food bin and dole it out daily.  That way my cat can't get into the bag and spread the food all over the floor.  I picked the air-tight container up from a local discount store for $12.99.  Overall - I think this is just a much more economical way for me to keep the food my cat loves in the house.,"09 1, 2016",My cat loves it - one bag lasts me 3 months with one cat,True,2016-09-01
p4,B00BD76NZK,A3EUD7GBM5R0WV,,4.0,Great value and my cat thrives on this food!,"09 1, 2016",Great value,True,2016-09-01
p4,B00BD76NZK,A1VZ7L5VXG216X,,5.0,"Good, great to deliver to my door so I don't have a trip to make and a heavy bag to carry.","08 13, 2016","Good, great to deliver to my door so I ...",True,2016-08-13
p4,B00BD76NZK,A1T1YTFO6T1UNH,,5.0,Been buying for years for long haired Maine coon. Shiny fur and no hairballs.,"08 10, 2016",Long haired Mainecoon has shiny coat and no hairballs,True,2016-08-10
p4,B00BD76NZK,A3RQ0BWL49PVM1,,5.0,Tried several different kinds of cat food. This is what cats like.,"08 2, 2016",This is what cats like.,True,2016-08-02
p4,B00BD76NZK,A3RWP1I8UFUZ22,,5.0,"This is all my Maine Coon cat will eat. He hates all other kitty food, even wet food and with his long hair the hairball remedy helps him a lot. The price seems to vary a lot so I order two bags whenever I see it listed for $17-18. One bag lasts us about 4-5 weeks with 2 cats. One large (the Maine Coon) and one smaller cat (siamese mix).","08 1, 2016",Great for Maine Coon and other Cats with Lots of Fur,True,2016-08-01
p4,B00BD76NZK,AC6NUFZ97BKMH,,5.0,"My somewhat fussy cat loves this dry cat food.  He has been ""hacking"" recently so I thought it might help him.  He doesn't allow any brushing and even though he is a fairly short hair, he still sheds and I'm sure ingests a lot of hair while grooming himself.  Have tried other brands which he won't eat - so this one is a win-win for both of us.  Thanks Iams.","07 28, 2016",Fussy cat loves Iams Hairball Care Dry Cat Foos,True,2016-07-28
p4,B00BD76NZK,A3V4QVB9Z5S693,,1.0,Buyer beware.... the product is fine but not when it comes full of mold and makes the cat sick.  The vet tested some of the bag and suggested not buying this online again!,"07 20, 2016",Buyer beware,True,2016-07-20
p4,B00BD76NZK,A3CMMNV95DROMP,,5.0,"Best product I can find for my long haired, indoor cats.  A+","07 11, 2016",Just Like It Says.,True,2016-07-11
p4,B00BD76NZK,A1RFZGWX46N8H7,,2.0,"I have been feeding my cats Iams for a few years now, especially since one of them tends to have a sensitive stomach and only seems to keep Iams Original and Iams Sensitive Stomach down 99% of the time.  She throws up mostly every other brand so I don't even bother anymore.  I figured I would expand their choice by trying this one, but sadly, neither cat ate much of it at all.","07 7, 2016","Iams is a name I trust, and a brand my cats love, but neither liked this variety",False,2016-07-07
p4,B00BD76NZK,A2RW3HRG19E3KE,,4.0,Good price and so grateful it is delivered to the front door!  It has been difficult to find this size locally - usually only 3+or over15 lb bags. I have always fed my jadult cats this particular brand.  Sam transitioned easily to this from Iams kitten food (no digestive tract problems).,"06 17, 2016",Good Price and Convenient,True,2016-06-17
p4,B00BD76NZK,A2XCD4SWBO9IK,,5.0,My cats' favorite dry food ever!,"06 15, 2016",Five Stars,True,2016-06-15
p4,B00BD76NZK,ATTP8EUQFMN7K,,4.0,Works well for my Maine Coon kitten.  Iam's hairball cat food is the only dry food his breeder recommends,"06 12, 2016",Four Stars,True,2016-06-12
p4,B00BD76NZK,A1FH14TQSVDH1X,,5.0,"Well if kitty is happy, then who am I to say otherwise?
She eats it and we haven't noticed any concerns with hairballs and that's a relief.  I can't say for certain that there is a connection, but she does fine eating it.","06 2, 2016",She likes it,False,2016-06-02
p4,B00BD76NZK,AI5OS4RQQIUMJ,,5.0,"My cat is the perfect target market for this food: she's indoor, has weight issues, and is prone to hairballs. I cycle her through a variety of dry foods. I feed her canned, Weruva food in the morning. In the evening, I give her a bit of dry food to hold her until morning. Typically I choose dry foods that are targeted to weight and/or hairball issues. She's not a picky eater and will eat whatever I give her, but has her favorites for sure. Iams proactive health is definitely a new favorite. She loves the taste, her bowel movements have improved, and her hairballs are less frequent.

Other reviewers are complaining about the ingredients, but I'm only seeing positive results with the food. Considering it's not my cat's only source of nutrition, I'm sold.","06 1, 2016",Cat loves it and it's working well,True,2016-06-01
p4,B00BD76NZK,AWKZAUC0D8DYL,,2.0,"As much as I would have liked to give this food a good review, one look at the ingredient list* and I was not very impressed.  The first ingredient listed is chicken by-product meal, which is NOT near as high-quality an ingredient as if it was listed as ""Chicken"".  But the next two ingredients are corn products - corn meal, corn grits and the rest of the ingredient list is equally unimpressive.

My cats are not picky so yes, they will eat it.  But this is not the high-quality diet I prefer to feed them, to avoid health issues related to poor diet.

Iams is a well-known brand and not the cheapest pet food out there so I have to say I'm pretty disappointed in this variety.

*(Copied and pasted from Amazon product page) Ingredient list:
CHICKEN BY-PRODUCT MEAL, CORN MEAL, CORN GRITS, GROUND WHOLE GRAIN SORGHUM, DRIED BEET PULP, POWDERED CELLULOSE, CHICKEN, CHICKEN FAT (PRESERVED WITH MIXED TOCOPHEROLS, A SOURCE OF VITAMIN E), DRIED EGG PRODUCT, NATURAL FLAVOR, BREWERS DRIED YEAST, SODIUM BISULFATE, POTASSIUM CHLORIDE, CHOLINE CHLORIDE, DL-METHIONINE, FISH OIL (PRESERVED WITH MIXED TOCOPHEROLS, A SOURCE OF VITAMIN E), FRUCTOOLIGOSACCHARIDES, DICALCIUM PHOSPHATE, CALCIUM CARBONATE, SALT, VITAMINS (VITAMIN E SUPPLEMENT, NIACIN, ASCORBIC ACID, VITAMIN A ACETATE, CALCIUM PANTOTHENATE, BIOTIN, THIAMINE MONONITRATE (SOURCE OF VITAMIN B1), PYRIDOXINE HYDROCHLORIDE (SOURCE OF VITAMIN B6), VITAMIN B12 SUPPLEMENT, RIBOFLAVIN SUPPLEMENT (SOURCE OF VITAMIN B2), INOSITOL, VITAMIN D3 SUPPLEMENT, FOLIC ACID), TAURINE, MINERALS (ZINC OXIDE, MANGANESE SULFATE, COPPER SULFATE, POTASSIUM IODIDE), L-CARNITINE, CITRIC ACID, ROSEMARY EXTRACT","05 31, 2016",Disappointing,False,2016-05-31
p4,B00BD76NZK,A5H86XYSS0OU6,,5.0,"I have two cats. One gets hair balls and the other is quite overweight, at 25 lbs. We have introduced numerous dietary options to their diets at great cost without much success. They only eat certain flavors and would rather be hungry then eat something unappealing.

IAMS indoor weight and hairball prevention dry cat food has proven to be the ideal product. It works and is not nearly as expensive as some other brands, especially for weight loss. Not only do the cats really like the flavor, they are not getting sick or putting on more weight. In fact, the heavier cat lost a half pound in the past week or two. The other cat rarely will eat dry food, and she has been devouring it.","05 30, 2016",Even picky eaters like it,False,2016-05-30
p4,B00BD76NZK,A3DS0VAXL90E26,,4.0,"IAMS Proactive Health Indoor Weight and Hairball control formula is a decent cat food for adult cats.  My older cat, who was very picky, was a big fan of IAMS in the dark green bag (Senior Plus or Lively Senior), so when he passed and we got a new rescue cat, I decided to see if he would enjoy the younger cat version of the food.

Being a rescue cat, Simon is used to eating whatever is donated to the group.  He was on Purina One, and after the appropriate switch over time, he is now eating the IAMS alone.  He is eating the same quantity of food as before, and everything digestive tract wise is the same as one the Purina One.

Good value for the price, and my less than choosy cat eats it.","05 27, 2016",Good value for a mid-range cat food,False,2016-05-27
p4,B00BD76NZK,A1Q9UC0TIDUXR6,,5.0,"My cat has decided that this is all she will eat, I tried mixing it with other food to get rid of the old food.  I ended up having to pick out the food she deemed as inedible (she was fine with it before) so this was the only food in the bowl, she is strongly committed to this food.","05 27, 2016",I ended up having to pick out the food she deemed as inedible (she was fine with it before) so this was the only food ...,True,2016-05-27
p4,B00BD76NZK,A1B70ZEWQ6UH1A,,3.0,"Heres the nutrition profile, since Amazon doesnt have it shown:
Crude Protein, minimum  32.00%
Crude Fat, minimum  13.00%
Crude Fat, maximum  15.50%
Crude Fiber, maximum 6.50%
Moisture, maximum  10.00%
Ash, maximum  7.00%
Magnesium, maximum  0.10%
Vitamin E, minimum  250 IU/kg
Taurine, minimum 0.15%
L-Carnitine, minimum 80 mg/kg
Omega-6 Fatty Acids, minimum 1.67%
Omega-3 Fatty Acids, minimum 0.17%

This food has 3,381 kcal/kg, or 288.06 kcal/cup.

Since l-carnitine is promoted as a reason to select this particular food, I will take a closer look at it.  It occurs naturally in meat, and extra is added to this food.

Do note, however, that high levels of l-carnitine probably aren't a good idea if your cat has hypothyroidism, as the study Carnitine is a naturally occurring inhibitor of thyroid hormone nuclear uptake in the Thyroid: Official Journal of the American Thyroid Association indicates that l-carnitine is an antagonist of thyroid hormone.  The abstract of this study states, At 10 mM carnitine, inhibition of T3 nuclear uptake was disproportionately higher, namely approximately 25% in neurons and 35% in hepatocytes. At 50 mM carnitine, there was a minimal additional decrease in whole-cell uptake of either hormone but a marked decrease in T3 nuclear uptake. The latter inhibition was approximately 60% in neurons and 70% in hepatocytes. We are aware of no inhibitor of TH uptake that has such a markedly different effect on the nuclear versus whole-cell uptake. Our data are consistent with carnitine being a peripheral antagonist of TH action, and they indicate a site of inhibition at or before the nuclear envelope.  That is of some concern to me, as overweight cats may, indeed, have hypothyroidism.
On the other hand, l-carnitine is probably beneficial if your cat has HYPERthryoidism and this disorder is far more common.  L-carnitine may help reduce some symptoms of hyperthyroidism.

L-carnitine may help your cat lose weight while maintaining lean muscle mass.  Research on this is still preliminary.  The study Dietary L-carnitine supplementation in obese cats alters carnitine metabolism and decreases ketosis during fasting and induced hepatic lipidosis states These results demonstrate the protective effect of a dietary L-carnitine supplement against fasting ketosis during obesity induction. Increasing the L-carnitine level of diets in cats with low energy requirements, such as after neutering, and a high risk of obesity could therefore be recommended.  Since fasting ketosis is a serious issue with cats who lose weight too rapidly, this is important.

Overall, Im not impressed with the amount of corn in this food.  I prefer the Iams ProActive Health Adult Hairball Care food, which has chicken and then chicken by-product meal as the top two ingredients.  This other formula has the same amount of l-carnitine as the reviewed food.  Indeed, all the Iams dry cat food I checked has the same amount of l-carnitine, though only some of them are actively promoted as having l-carnitine to help burn fat and maintain healthy metabolism.  To conclude, I think there are better Iams foods than this one.","05 24, 2016",Important info for cats with thyroid problems,False,2016-05-24
p4,B00BD76NZK,ACL0T7X1THPAV,,2.0,"I have reviewed several cat foods in the past couple years:

<a data-hook=""product-link-linked"" class=""a-link-normal"" href=""/Solid-Gold-Furrever-Young-Holistic-Dry-Cat-Food-Turkey-Brown-Rice-Cranberry-Less-Active-Adult-Cats-All-Sizes-4lb-Bag/dp/B00X0GTVQK/ref=cm_cr_arp_d_rvw_txt?ie=UTF8"">Solid Gold Furrever Young Holistic Dry Cat Food, Turkey, Brown Rice & Cranberry, Less Active Adult Cats, All Sizes, 4lb Bag</a>
<a data-hook=""product-link-linked"" class=""a-link-normal"" href=""/NUTRO-Adult-Cat-Chunky-Loaf-Chicken-Dinner-Canned-Cat-Food-Pack-of-24/dp/B00TZMCB06/ref=cm_cr_arp_d_rvw_txt?ie=UTF8"">NUTRO Adult Cat Chunky Loaf Chicken Dinner Canned Cat Food (Pack of 24)</a>
<a data-hook=""product-link-linked"" class=""a-link-normal"" href=""/Nutro-Core-Dry-Cat-Food-Company-High-Protein-Adult-Food-with-Chicken-and-Whole-Brown-Rice-Recipe-for-Finicky-Felines-3-Pound/dp/B00TZI3QFE/ref=cm_cr_arp_d_rvw_txt?ie=UTF8"">Nutro Core Dry Cat Food Company High Protein Adult Food with Chicken and Whole Brown Rice Recipe for Finicky Felines, 3-Pound</a>
<a data-hook=""product-link-linked"" class=""a-link-normal"" href=""/Hill-s-Ideal-Balance-Crafted-Grain-Free-Herbed-Chicken-and-Chickpeas-Recipe-Dry-Cat-Food-Bag-6-Pound/dp/B00TH3MNB0/ref=cm_cr_arp_d_rvw_txt?ie=UTF8"">Hill's Ideal Balance Crafted Grain Free Herbed Chicken and Chickpeas Recipe Dry Cat Food Bag, 6-Pound</a>

This IAMS ""Indoor Weight and Hairball Care"" food is really not that good.  It has a lot of fillers in it (corn, sorghum, beet pulp, cellulose(!)) and a bunch of chemicals that I assume are mostly vitamins to make up for the lack of natural nutrition.  The cats will eat it, but I think better of my pets than to feed them cheap junk food.  Felines don't eat this stuff in nature.

The best dry cat food I have tested is the Hill's Ideal Balance.  There are also some other brands with less or no fillers, like Instinct, Nutrish and Nutro.  Also, one I have not tried yet, but seems to be higher-end is this:&nbsp;<a data-hook=""product-link-linked"" class=""a-link-normal"" href=""/Orijen-Cat-Kitten-Dry-Cat-Food-5-Lbs/dp/B00BXHHMAA/ref=cm_cr_arp_d_rvw_txt?ie=UTF8"">Orijen Cat & Kitten Dry Cat Food 5 Lbs.</a>&nbsp;Let me know in the comments if you try this one and like it.","05 18, 2016","Fillers and chemicals... but ""where's the beef?""",False,2016-05-18
p4,B00BD76NZK,A3CG93783LP0FO,,4.0,"While I don't think this is the best cat food available, it's what my cats want to eat. And it's certainly better than Meow Mix and those cheaper grocery store foods. I remember when I first started purchasing this maybe 10+ years ago, it wasn't available at the supermarket at all. Occasionally I will try something more expensive, supposedly better, or even grain-free, and my cats will be gung-ho on eating the new cat food for a few weeks - then they lose interest in it. They want their Iams back. My oldest cat ate this most of her life and she almost made it to age 18. Even when her kidneys were failing she didn't want the prescription kidney diet, she wanted this....and at that stage my vet said it's better she eats the Iams than not eat at all.

As far as hairballs, this helps some. I also give Laxatone and I try to brush my Maine Coon daily, but she still has an occasional hairball but it's on the smaller side. This food works better at controlling hairballs than OTHER brands of hairball food I've tried that were twice the price.

This is also lower in calories if you check the nutritional kcals of other foods online, this one is about 2/3 of the caloric value compared to more expensive hairball/weight management brands other than Iams.

My cats give this 5 stars, I give it 4.","05 18, 2016",My cats approve!,False,2016-05-18
p4,B00BD76NZK,A3VGAP2KLCBNBB,,4.0,"Kitties seem to like it, although they appear to be eating slightly more of it than their previous food. No extra hairballs.","05 17, 2016",Four meows of approval,False,2016-05-17
p4,B00BD76NZK,A21VGNU5959O85,,5.0,"My cats, tore into this before they even finished the food they had. That is how much they love it. I actually mixed the old food with this? and they PICKED out this food and left the other!","05 16, 2016",Yum,False,2016-05-16
